[
  {
    "reconciliation_id": "reconciliation:03",
    "tenant_id": "tenant-a",
    "app_id": "app-a",
    "input_snapshot_id": "internal-snapshot:03",
    "external_snapshot_id": "external-snapshot:03",
    "difference_reason_code": "external_row_unmatched",
    "difference_reason_version": "0.2.0",
    "matching_keys": [
      {
        "type": "provider_click_id",
        "value": "unknown-click_0000000000000000",
        "scope": "tenant_app",
        "normalization": "identity",
        "cardinality": "one_to_one",
        "protected": true
      }
    ],
    "candidates": [],
    "exclusions": [],
    "windows": [],
    "joins": [],
    "freshness": "current"
  }
]
