[
  {
    "reconciliation_id": "reconciliation:23",
    "tenant_id": "tenant-a",
    "app_id": "app-a",
    "input_snapshot_id": "internal-snapshot:23",
    "external_snapshot_id": "external-snapshot:23",
    "difference_reason_code": "freshness_mismatch",
    "difference_reason_version": "0.2.0",
    "matching_keys": [
      {
        "type": "provider_install_id",
        "value": "synthetic-install-23",
        "scope": "tenant_app",
        "normalization": "identity",
        "cardinality": "one_to_one",
        "protected": true
      }
    ],
    "candidates": [
      "install-23"
    ],
    "exclusions": [],
    "windows": [
      "install-23:in_window"
    ],
    "joins": [
      "provider_install_id:synthetic-install-23=>install-23"
    ],
    "freshness": "stale"
  }
]
