[
  {
    "reconciliation_id": "reconciliation:19",
    "tenant_id": "tenant-a",
    "app_id": "app-a",
    "input_snapshot_id": "internal-snapshot:19",
    "external_snapshot_id": "external-snapshot:19",
    "difference_reason_code": "candidate_excluded",
    "difference_reason_version": "0.2.0",
    "matching_keys": [
      {
        "type": "provider_click_id",
        "value": "click-prefetch_0000000000000000",
        "scope": "tenant_app",
        "normalization": "identity",
        "cardinality": "one_to_one",
        "protected": true
      }
    ],
    "candidates": [
      "prefetch-click"
    ],
    "exclusions": [
      "bot_prefetch"
    ],
    "windows": [
      "prefetch-click:in_window"
    ],
    "joins": [
      "provider_click_id:click-prefetch_0000000000000000=>prefetch-click"
    ],
    "freshness": "current"
  }
]
